{
  "$schema": "../../../modules/module.schema.json",
  "id": "access",
  "package": "@platform/access",
  "version": "0.1.0",
  "distribution": "shareable",
  "category": "security",
  "toggleable": false,
  "description": "Product-agnostic admin access policy: justification-gated PII grants, device enrollment tokens, access-log pre-filter and pseudonymisation for AI audit. Pure logic, no I/O.",
  "provides": {
    "routes": [],
    "apis": [],
    "jobs": [],
    "ui": [],
    "tables": []
  },
  "requires": {
    "modules": {}
  },
  "env": [],
  "migrations": [],
  "conformance": [
    "fail-closed-decisions",
    "no-pii-in-model-payload"
  ],
  "tests": [
    "apps/web/tests/platform-access.test.ts"
  ],
  "dataPolicy": "אין מידע במודול. כל הרשומות נשמרות במסד של המוצר שמתקין אותו, על השרתים שלו.",
  "store": {
    "name": "בקרת גישה למידע אישי",
    "summary": "כללים שמחליטים מתי מנהל רשאי לראות מידע אישי של משתמש: רק עם סיבה כתובה, לזמן קצר, ועם רישום. כולל גם צירוף מכשיר חדש לניהול וסינון מוקדם של יומני גישה לפני בדיקה אוטומטית.",
    "audience": [
      "מוצרים שיש בהם צוות ניהול שצריך לפעמים לראות מידע של משתמש",
      "מי שצריך לעמוד בדרישות פרטיות ולהראות מי ראה מה ולמה"
    ],
    "useCases": [
      "מנהל פותח פרטי משתמש לטיפול בפנייה, וחייב לכתוב סיבה של 15 תווים לפחות",
      "צירוף מחשב חדש לפאנל הניהול עם קישור חד־פעמי שתוקפו 10 דקות",
      "סימון גישות חשודות (שעות חריגות, מכשיר חדש, הרבה משתמשים ברצף) לפני בדיקה"
    ],
    "features": [
      "בדיקת סיבה: קצרה מדי, ארוכה מדי או סתמית (\"בדיקה\", \"test\") נדחית",
      "הרשאת צפייה ל-30 דקות כברירת מחדל, ולא יותר משעה",
      "קישורי צירוף מכשיר: חד־פעמיים, 10 דקות, עד 3 פתוחים",
      "סינון יומן גישה לפי 7 סימנים חשודים",
      "הכנת נתוני היומן לבדיקה בלי פרטים מזהים"
    ],
    "dataTouched": [
      "לא שומר מידע בעצמו. מקבל מהמוצר רשומות הרשאה וגישה ומחזיר החלטה"
    ],
    "permissions": [
      "אין הרשאות משלו. המוצר מחליט מי קורא לו"
    ],
    "security": [
      "כל ההחלטות בצד השרת",
      "ברירת מחדל: סירוב",
      "הנתונים שנשלחים לבדיקה אוטומטית לא כוללים שמות, מיילים או מזהים"
    ],
    "whereDataLives": "אין מידע במודול. כל הרשומות נשמרות במסד של המוצר שמתקין אותו, על השרתים שלו.",
    "installConfig": "אין קובץ הגדרות. המוצר מייבא את הפונקציות ושומר את ההרשאות במסד שלו.",
    "compatibility": "TypeScript, Node 20 ומעלה. בלי תלויות חיצוניות.",
    "limitations": [
      "המודול רק מחליט; שמירת ההרשאות והצגת המסכים הן באחריות המוצר",
      "לא נבדק עדיין בהתקנה אצל קונה חיצוני; הבדיקה היחידה היא בתוך NuraWell ובמוצר הדוגמה."
    ],
    "support": "תמיכה דרך דניאל (בעל הספרייה). תיקונים חוזרים לספרייה כ-PR לריפו NuraWell, עם בדיקות.",
    "descriptionHe": "מודול שמחליט מי מהמנהלים רשאי לראות מידע אישי של משתמשים, ומתי. כדי לראות מידע כזה צריך לכתוב סיבה אמיתית, והגישה נפתחת לזמן קצוב בלבד. המודול גם מייצר קישורים חד־פעמיים לצירוף מכשיר חדש של מנהל, מסמן ביומן הגישה פעולות שנראות חשודות, ומסיר פרטים מזהים לפני שהיומן נבדק אוטומטית. הוא רק מחליט: הוא לא שומר נתונים בעצמו ולא מציג מסכים."
  }
}
