{
  "$schema": "../../../modules/module.schema.json",
  "id": "module-library-ui",
  "package": "@platform/module-library-ui",
  "version": "0.1.0",
  "distribution": "internal",
  "category": "ops",
  "toggleable": true,
  "description": "Mac Finder-style ops dashboard: product sidebar, module library (icon/list), per-product toggles, tier badges, detail panel. v1 is a mock with fake data.",
  "provides": {
    "routes": [
      "/ops/modules"
    ],
    "apis": [],
    "jobs": [],
    "ui": [
      "FinderDashboard"
    ],
    "tables": []
  },
  "requires": {
    "modules": {}
  },
  "env": [],
  "migrations": [],
  "conformance": [
    "config-secure-defaults",
    "disabled-means-404"
  ],
  "tests": [
    "apps/web/tests/mod-module-library-ui.test.ts"
  ],
  "dataPolicy": "Holds no data. v1 uses in-memory mock data only; toggles are not persisted."
}
