{
  "$schema": "../../../modules/module.schema.json",
  "id": "ai-engine",
  "package": "@platform/ai-engine",
  "version": "0.1.0",
  "distribution": "shareable",
  "category": "platform",
  "toggleable": true,
  "description": "Product-agnostic AI engine: provider client (OpenAI-compatible or mock), mandatory privacy guard, cost logging tagged by product and feature. No env reads.",
  "provides": {
    "routes": [],
    "apis": [],
    "jobs": [],
    "ui": [],
    "tables": []
  },
  "requires": {
    "modules": {}
  },
  "env": [],
  "migrations": [],
  "conformance": [
    "privacy-guard-always-on",
    "cost-row-per-call"
  ],
  "tests": [
    "apps/web/tests/platform-packages.test.ts"
  ],
  "dataPolicy": "המודול לא שומר כלום. רישומי העלות נכתבים למקום שהמוצר מזריק (במסד שלו).",
  "store": {
    "name": "מנוע AI משותף",
    "summary": "שכבה אחת שדרכה כל מוצר שולח בקשות למודל AI. לפני כל שליחה היא מוחקת מיילים, טלפונים, תעודות זהות ומספרי כרטיס, ואחרי כל תשובה היא רושמת כמה זה עלה ולאיזה פיצ׳ר.",
    "audience": [
      "מוצרים שמשתמשים ב-AI ורוצים לדעת כמה כל פיצ׳ר עולה",
      "מי שחייב שמידע מזהה לא יגיע לספק ה-AI"
    ],
    "useCases": [
      "צ׳אט או סיכום שעובר דרך מנוע אחד במקום קוד נפרד בכל מוצר",
      "דוח עלויות לפי מוצר ולפי פיצ׳ר",
      "בדיקות בלי עלות עם ספק מדומה"
    ],
    "features": [
      "מסנן פרטיות שתמיד פועל (אי אפשר לכבות אותו)",
      "שתי רמות מודל: זול וחזק, והמוצר בוחר מה כל רמה",
      "רישום עלות לכל קריאה, מתויג במוצר ובפיצ׳ר",
      "מגבלת זמן לכל בקשה",
      "ספק מדומה לבדיקות"
    ],
    "dataTouched": [
      "טקסט הבקשה, אחרי סינון פרטים מזהים",
      "נתוני שימוש: מספר טוקנים, מודל, פיצ׳ר, מזהה משתמש מוסתר (לא שם או מייל)"
    ],
    "permissions": [
      "אין הרשאות משלו"
    ],
    "security": [
      "המסנן מוחק מיילים, טלפונים ישראליים, מספרי זהות וכרטיסים לפני השליחה",
      "מפתח ה-API של ספק ה-AI מוזרק על ידי המוצר; המודול לא קורא משתני סביבה",
      "כישלון ברישום עלות לא שובר את התשובה"
    ],
    "whereDataLives": "המודול לא שומר כלום. רישומי העלות נכתבים למקום שהמוצר מזריק (במסד שלו).",
    "installConfig": "המוצר יוצר מנוע אחד: מזהה מוצר, ספק, מקום לרישום עלויות ושמות שני המודלים.",
    "compatibility": "TypeScript, Node 20 ומעלה. כל ספק שתומך בפורמט OpenAI.",
    "limitations": [
      "המסנן מזהה תבניות נפוצות בלבד; שמות פרטיים בטקסט חופשי לא נמחקים",
      "אין כרגע מתג הפעלה לפי מוצר בפאנל",
      "לא נבדק עדיין בהתקנה אצל קונה חיצוני; הבדיקה היחידה היא בתוך NuraWell ובמוצר הדוגמה."
    ],
    "support": "תמיכה דרך דניאל (בעל הספרייה). תיקונים חוזרים לספרייה כ-PR לריפו NuraWell, עם בדיקות.",
    "descriptionHe": "המנוע שדרכו כל מוצר מדבר עם מודל בינה מלאכותית. לפני כל שליחה הוא מסנן פרטים אישיים נפוצים (כמו טלפון ואימייל), ואחרי כל קריאה הוא רושם כמה היא עלתה, לפי מוצר ולפי תכונה, כדי שאפשר יהיה לראות את העלויות בלוח הבקרה. אפשר לחבר אליו כל ספק שעובד בפורמט המקובל, או מצב ניסיון שלא עולה כסף."
  }
}
